create table SALESMAN(
salesman_id number(5),
Name varchar(20),
city varchar(10),
commission number(10),
primary key(salesman_id));

insert into SALESMAN values(1000,'cbum','russia',10000);
insert into SALESMAN values(1001,'roman','italy',5000);
insert into SALESMAN values(1002,'rocky_balboa','america',130000);
insert into SALESMAN values(1004,'sam sulek','russia',7000);
insert into SALESMAN values(1005,'creed','india',50000);
insert into SALESMAN values(1003,'cbum','russia',10000);

create table CUSTOMER(
customer_id number(5),
customer_name varchar(10),
city varchar(10),
Grade number(10),
salesman_id number(5),
primary key(customer_id),
foreign key(salesman_id) references SALESMAN(salesman_id) on delete set null);

insert into CUSTOMER values(0102,'yashwanth','bangalore',100,1000);
insert into CUSTOMER values(0104,'lakshmi','hassan',101,1001);
insert into CUSTOMER values(0105,'karthik','hospete',102,1002);
insert into CUSTOMER values(0107,'chinthan','mysore',103,1004);
insert into CUSTOMER values(0109,'kathad','mangalore',100,1005);
insert into CUSTOMER values(0108,'yashwanth','mumbai',101,1000);


create table ORDERS(
order_no number(5),
purchase_id number(5),
order_date date,
customer_id number(5),
salesman_id number(5),
primary key(salesman_id ,customer_id),
foreign key(salesman_id) references SALESMAN(salesman_id) on delete cascade,
foreign key(customer_id) references CUSTOMER(customer_id) on delete cascade);


insert into ORDERS values(54621,7980,'02-jul-2023',0102,1000);
insert into ORDERS values(54622,7980,'30-jan-2023',0104,1001);
insert into ORDERS values(54623,7980,'30-dec-2023',0105,1002);
insert into ORDERS values(54625,7980,'08-sep-2023',0107,1004);
insert into ORDERS values(54625,7980,'21-jun-2023',0109,1005);


QUERIES:-

1).select Grade,count(distinct customer_id)
from CUSTOMER 
group by Grade
having Grade>(select AVG(Grade)
from CUSTOMER
where city='bangalore');

GRADE COUNT(DISTINCTCUSTOMER_ID)
---------- --------------------------
       102                          1
       101                          2
       103                          1

2).select salesman_id,name
from SALESMAN S
where 1<(select count(*)
from CUSTOMER
where salesman_id=S.salesman_id);

no rows selected;

 
3) SELECT SALESMAN.salesman_id, Name,customer_name, commission 
   FROM SALESMAN , CUSTOMER 
   WHERE SALESMAN.city = CUSTOMER.city 
   UNION (SELECT salesman_id, Name, 'NO MATCH', commission 
   FROM SALESMAN WHERE NOT city = ANY (SELECT city FROM CUSTOMER))
   ORDER BY 2 DESC;

SALESMAN_ID NAME                 CUSTOMER_N COMMISSION
----------- -------------------- ---------- ----------
       1004 sam sulek            NO MATCH         7000
       1001 roman                NO MATCH         5000
       1002 rocky_balboa         NO MATCH       130000
       1005 creed                NO MATCH        50000
       1000 cbum                 NO MATCH        10000
       1003 cbum                 NO MATCH        10000

4)
CREATE VIEW V_salesman
AS SELECT O.order_date, S.salesman_id, S.Name
FROM SALESMAN S, ORDERS O
WHERE S.salesman_id = O.salesman_id
AND O.purchase_id =
(SELECT MAX (purchase_id)
 FROM ORDERS c
 WHERE c.order_date = O.order_date);

SELECT * FROM V_salesman;

ORDER_DAT SALESMAN_ID NAME
--------- ----------- --------------------
02-JUL-23        1000 cbum
30-JAN-23        1001 roman
30-DEC-23        1002 rocky_balboa
08-SEP-23        1004 sam sulek
21-JUN-23        1005 creed

5)
delete from SALESMAN
where salesman_id=1000;

select * from SALESMAN;

SALESMAN_ID NAME                 CITY       COMMISSION
----------- -------------------- ---------- ----------
       1001 roman                italy            5000
       1002 rocky_balboa         america        130000
       1004 sam sulek            russia           7000
       1005 creed                india           50000
       1003 cbum                 russia          10000




